{
  "$schema": "http://json-schema.org/draft-07/schema#",
  "$id": "https://vais.local/schemas/check-result.schema.json",
  "title": "VAIS v2 Check Result",
  "type": "object",
  "additionalProperties": false,
  "required": ["check", "execution", "verdict", "required", "scope", "requirements", "summary", "findings", "evidence"],
  "properties": {
    "check": { "type": "string", "pattern": "^[a-z0-9][a-z0-9-]*$" },
    "execution": { "enum": ["succeeded", "errored", "unavailable"] },
    "verdict": { "enum": ["pass", "fail", "blocked"] },
    "required": { "type": "boolean" },
    "scope": { "type": "array", "items": { "type": "string", "minLength": 1 } },
    "requirements": { "type": "array", "uniqueItems": true, "items": { "type": "string", "pattern": "^REQ-[0-9]{3}$" } },
    "summary": { "type": "string", "minLength": 1, "maxLength": 1000 },
    "findings": { "type": "array", "items": { "type": "string", "minLength": 1 } },
    "warnings": { "type": "array", "items": { "type": "string", "minLength": 1 } },
    "evidence": { "type": "array", "items": { "type": "string", "minLength": 1 } }
  }
}
