{
  "check": "independent-qa-handoff",
  "execution": "succeeded",
  "verdict": "pass",
  "required": true,
  "scope": [],
  "requirements": [
    "REQ-001",
    "REQ-002",
    "REQ-003",
    "REQ-004",
    "REQ-005"
  ],
  "summary": "Independent QA completed without a failure verdict",
  "findings": [],
  "evidence": [
    "docs/work-items/harness-guidance-limits/2026-09-17-harness-guidance-limits/04-review/evidence/handoffs/AS-b4c23a5b-cd9e-4cdf-9ec5-98ba17082aa2.json"
  ]
}
