{
  "check": "test",
  "execution": "succeeded",
  "verdict": "pass",
  "required": true,
  "scope": [
    "lib/workflow/v2/**",
    "hooks/**",
    "scripts/vais-workflow-v2.js",
    "schemas/check-result.schema.json",
    "tests/**",
    "README.md",
    "CLAUDE.md",
    "ONBOARDING.md",
    "docs/harness/**",
    "CHANGELOG.md",
    "package.json",
    "package-lock.json",
    "vais.config.json",
    ".claude-plugin/**"
  ],
  "requirements": [],
  "summary": "Check passed",
  "findings": [],
  "evidence": [
    "docs/work-items/unattended-chain/2026-09-29-unattended-chain/03-do/evidence/logs/test.log"
  ]
}
