{
  "check": "document-repetition",
  "execution": "succeeded",
  "verdict": "pass",
  "required": true,
  "scope": [
    "docs/work-items/unattended-chain/2026-09-29-unattended-chain/04-review/main.md"
  ],
  "requirements": [
    "REQ-026"
  ],
  "summary": "No long authored sentence is copied from an earlier phase",
  "findings": [],
  "evidence": [
    "docs/work-items/unattended-chain/2026-09-29-unattended-chain/04-review/main.md"
  ]
}
