{
  "check": "transient-drafts",
  "execution": "succeeded",
  "verdict": "pass",
  "required": true,
  "scope": [
    "docs/work-items/harness-readme-status-2/2026-09-17-harness-readme-status-2"
  ],
  "requirements": [
    "REQ-025"
  ],
  "summary": "No transient draft Markdown remains",
  "findings": [],
  "evidence": []
}
