{
  "check": "document-budget",
  "execution": "succeeded",
  "verdict": "pass",
  "required": true,
  "scope": [
    "docs/work-items/harness-docs-module-count/2026-09-17-harness-docs-module-count/04-review/main.md"
  ],
  "requirements": [
    "REQ-009",
    "REQ-026"
  ],
  "summary": "Authored Markdown 1771B is within the 5120B compact budget",
  "findings": [],
  "evidence": [
    "docs/work-items/harness-docs-module-count/2026-09-17-harness-docs-module-count/04-review/main.md"
  ]
}
