{
  "check": "document-budget",
  "execution": "succeeded",
  "verdict": "pass",
  "required": true,
  "scope": [
    "docs/work-items/unattended-chain/2026-09-29-unattended-chain/01-plan/main.md"
  ],
  "requirements": [
    "REQ-009",
    "REQ-026"
  ],
  "summary": "Authored Markdown 6777B is within the 9216B standard budget",
  "findings": [],
  "evidence": [
    "docs/work-items/unattended-chain/2026-09-29-unattended-chain/01-plan/main.md"
  ]
}
