{
  "check": "lint",
  "execution": "succeeded",
  "verdict": "pass",
  "required": true,
  "scope": [
    "lib/**",
    "hooks/**",
    "scripts/**",
    "schemas/**",
    "contracts/**",
    "tests/**",
    "docs/harness/**",
    "package.json",
    "package-lock.json",
    "vais.config.json",
    ".claude-plugin/**",
    "CHANGELOG.md",
    "README.md",
    "CLAUDE.md",
    "ONBOARDING.md"
  ],
  "requirements": [],
  "summary": "Check passed",
  "findings": [],
  "evidence": [
    "docs/work-items/commands/2026-09-16-commands/03-do/evidence/logs/lint.log"
  ]
}
