{
  "check": "document-budget",
  "execution": "succeeded",
  "verdict": "pass",
  "required": true,
  "scope": [
    "docs/work-items/harness-health/2026-09-15-harness-health/02-design/main.md"
  ],
  "requirements": [
    "REQ-009",
    "REQ-026"
  ],
  "summary": "Authored Markdown 8410B is within the 10240B standard budget",
  "findings": [],
  "evidence": [
    "docs/work-items/harness-health/2026-09-15-harness-health/02-design/main.md"
  ]
}
