{
  "check": "design-document",
  "execution": "succeeded",
  "verdict": "pass",
  "required": true,
  "scope": [
    "docs/work-items/unattended-chain/2026-09-29-unattended-chain/02-design/main.md"
  ],
  "requirements": [],
  "summary": "Canonical design document is complete",
  "findings": [],
  "evidence": [
    "docs/work-items/unattended-chain/2026-09-29-unattended-chain/02-design/main.md"
  ]
}
