{
  "check": "document-budget",
  "execution": "succeeded",
  "verdict": "pass",
  "required": true,
  "scope": [
    "docs/work-items/commands/2026-09-16-commands/01-plan/main.md"
  ],
  "requirements": [
    "REQ-009",
    "REQ-026"
  ],
  "summary": "Authored Markdown 5527B is within the 6144B standard budget",
  "findings": [],
  "evidence": [
    "docs/work-items/commands/2026-09-16-commands/01-plan/main.md"
  ]
}
